{
  "arv": "1.0",
  "receipt_id": "rcp_5x",
  "moment_uri": "arv:vid_8f2c#t=12400,31000",
  "moment_id": "mom_rg2e4kdenkmkzilboihacumshn",
  "action": "segment_display",
  "served_to": {
    "agent": "chatgpt",
    "surface": "chat"
  },
  "policy_version": 7,
  "served_at": "2026-09-23T12:00:04Z",
  "citation": "Example Garage, Tuning a carburettor, 0:12",
  "jws": "eyJhbGciOiJFUzI1NiIsInR5cCI6ImFydi1yZWNlaXB0K2p3dCIsImtpZCI6ImstMjAyNi0wOSJ9...",
  "entitlement_ref": "ent_free_public"
}
